{
  "schemaVersion": 1,
  "timestamp": "2025-12-20T22:11:44.007Z",
  "suite": "pipeline",
  "runType": "warm",
  "env": {
    "browser": {
      "name": "Chrome",
      "version": "143.0.0.0"
    },
    "os": {
      "name": "macOS",
      "version": "10.15.7"
    },
    "gpu": {
      "vendor": "unknown",
      "device": "unknown",
      "description": "unknown"
    },
    "webgpu": {
      "hasF16": true,
      "hasSubgroups": true,
      "hasTimestampQuery": true
    }
  },
  "model": {
    "modelId": "llama-3.2-1b-instruct-q4",
    "quantization": "Q4_K",
    "totalSizeBytes": 799862912,
    "tensorCount": 147,
    "numLayers": 16,
    "hiddenSize": 2048
  },
  "workload": {
    "promptName": "xs",
    "promptTokens": 25,
    "maxNewTokens": 8,
    "sampling": {
      "temperature": 0.7,
      "topK": 1,
      "topP": 1
    }
  },
  "metrics": {
    "ttft_ms": 774,
    "prefill_ms": 648,
    "prefill_tokens_per_sec": 39,
    "decode_ms_total": 1286,
    "decode_tokens_per_sec": 5,
    "gpu_submit_count_prefill": 0,
    "gpu_submit_count_decode": 0,
    "gpu_submit_count_total": 2596,
    "gpu_allocation_count_total": 23,
    "gpu_readback_count_total": 261,
    "decode_ms_per_token_p50": 172.9000000357628,
    "decode_ms_per_token_p90": 208.05999999046327,
    "decode_ms_per_token_p99": 237.16599997758863,
    "gpu_readback_bytes_total": 128028,
    "gpu_timestamp_available": true,
    "gpu_time_ms_prefill": 0,
    "gpu_time_ms_decode": 0,
    "estimated_vram_bytes_peak": 3008387840,
    "opfs_usage_bytes": 810252752,
    "storage_persisted": false
  },
  "raw": {
    "decode_latencies_ms": [
      240.39999997615814,
      186.5,
      172.9000000357628,
      167.30000001192093,
      166,
      172.0999999642372,
      180.4000000357628
    ],
    "submit_times_ms": [
      0,
      0,
      0,
      0,
      0,
      0,
      0,
      0,
      0,
      0,
      0.10000002384185791,
      0,
      0.10000002384185791,
      0,
      0,
      0,
      0,
      0,
      0,
      0,
      0,
      0,
      0,
      0,
      0,
      0,
      0,
      0,
      0,
      0,
      0,
      0,
      0,
      0,
      0,
      0,
      0,
      0,
      0,
      0,
      0,
      0,
      0,
      0,
      0,
      0,
      0,
      0.09999996423721313,
      0,
      0.10000002384185791,
      0,
      0,
      0,
      0,
      0,
      0,
      0,
      0,
      0,
      0,
      0,
      0,
      0,
      0.09999996423721313,
      0,
      0,
      0,
      0,
      0,
      0,
      0,
      0,
      0,
      0,
      0,
      0,
      0,
      0,
      0,
      0,
      0,
      0,
      0,
      0,
      0,
      0,
      0,
      0,
      0,
      0,
      0,
      0,
      0,
      0,
      0,
      0,
      0,
      0,
      0,
      0,
      0,
      0,
      0,
      0,
      0.09999996423721313,
      0,
      0,
      0,
      0,
      0,
      0,
      0,
      0,
      0,
      0,
      0,
      0,
      0,
      0,
      0,
      0,
      0,
      0,
      0,
      0,
      0,
      0,
      0,
      0,
      0,
      0,
      0,
      0,
      0,
      0,
      0,
      0,
      0,
      0,
      0,
      0,
      0,
      0,
      0,
      0,
      0,
      0,
      0,
      0,
      0,
      0,
      0,
      0,
      0,
      0,
      0,
      0,
      0,
      0,
      0,
      0,
      0,
      0,
      0,
      0,
      0,
      0,
      0,
      0,
      0,
      0,
      0,
      0,
      0,
      0,
      0,
      0,
      0,
      0,
      0,
      0,
      0,
      0,
      0,
      0,
      0,
      0,
      0,
      0.10000002384185791,
      0,
      0,
      0.09999996423721313,
      0,
      0,
      0,
      0,
      0,
      0,
      0,
      0,
      0,
      0,
      0,
      0,
      0,
      0,
      0,
      0,
      0,
      0,
      0,
      0,
      0.09999996423721313,
      0,
      0,
      0,
      0,
      0,
      0,
      0,
      0,
      0,
      0,
      0,
      0.09999996423721313,
      0,
      0,
      0,
      0,
      0,
      0,
      0,
      0,
      0,
      0,
      0,
      0,
      0,
      0,
      0,
      0,
      0,
      0.09999996423721313,
      0,
      0,
      0,
      0,
      0,
      0,
      0,
      0,
      0,
      0,
      0,
      0,
      0,
      0,
      0,
      0,
      0,
      0,
      0,
      0,
      0.09999996423721313,
      0,
      0,
      0,
      0,
      0,
      0,
      0,
      0,
      0,
      0,
      0,
      0,
      0,
      0,
      0,
      0.09999996423721313,
      0,
      0,
      0,
      0,
      0,
      0,
      0,
      0,
      0,
      0,
      0,
      0,
      0,
      0,
      0,
      0,
      0.10000002384185791,
      0,
      0,
      0,
      0,
      0,
      0,
      0,
      0,
      0,
      0,
      0,
      0,
      0,
      0,
      0,
      0,
      0,
      0,
      0,
      0
    ],
    "generated_token_ids": [
      13118,
      14445,
      783,
      5532,
      23528,
      14584,
      74193,
      5065
    ],
    "generated_text": " indeedynchrontonbsp deserve academicudencecoming"
  }
}