{
  "schemaVersion": 1,
  "timestamp": "2025-12-17T21:21:39.869Z",
  "suite": "pipeline",
  "runType": "warm",
  "env": {
    "browser": {
      "name": "Chrome",
      "version": "143.0.0.0"
    },
    "os": {
      "name": "macOS",
      "version": "10.15.7"
    },
    "gpu": {
      "vendor": "unknown",
      "device": "unknown",
      "description": "unknown"
    },
    "webgpu": {
      "hasF16": true,
      "hasSubgroups": true,
      "hasTimestampQuery": true
    }
  },
  "model": {
    "modelId": "dcc83ea841ab6100d6b47a070329e1ba4cf78752",
    "quantization": "Q4_K_M",
    "totalSizeBytes": 997259520,
    "tensorCount": 314,
    "numLayers": 26,
    "hiddenSize": 1152
  },
  "workload": {
    "promptName": "xs",
    "promptTokens": 7,
    "maxNewTokens": 128,
    "sampling": {
      "temperature": 0,
      "topK": 1,
      "topP": 1
    }
  },
  "metrics": {
    "ttft_ms": 1158,
    "prefill_ms": 956,
    "prefill_tokens_per_sec": 7,
    "decode_ms_total": 49437,
    "decode_tokens_per_sec": 3,
    "gpu_submit_count_prefill": 0,
    "gpu_submit_count_decode": 0,
    "decode_ms_per_token_p50": 392.39999997615814,
    "decode_ms_per_token_p90": 465.39999997615814,
    "decode_ms_per_token_p99": 493.3399999976158,
    "gpu_readback_bytes_total": 3147252,
    "gpu_timestamp_available": true,
    "gpu_time_ms_prefill": 0,
    "gpu_time_ms_decode": 0,
    "estimated_vram_bytes_peak": 6896550912,
    "opfs_usage_bytes": 1014018062,
    "storage_persisted": false
  },
  "raw": {
    "decode_latencies_ms": [
      474.69999998807907,
      467.5,
      478.5,
      427.7000000476837,
      420.19999998807907,
      278.0999999642372,
      282,
      282.9000000357628,
      280.30000001192093,
      296,
      295.7999999523163,
      296.4000000357628,
      297.69999998807907,
      293.19999998807907,
      298.10000002384186,
      297.0999999642372,
      299.4000000357628,
      308.5999999642372,
      303.7000000476837,
      313,
      317.19999998807907,
      325.80000001192093,
      329,
      326,
      311.5,
      312.7999999523163,
      317.60000002384186,
      307.60000002384186,
      318.19999998807907,
      317,
      325.19999998807907,
      347.80000001192093,
      344.80000001192093,
      334.5,
      348.69999998807907,
      346.30000001192093,
      319.5999999642372,
      333.19999998807907,
      334.5,
      337.60000002384186,
      350.89999997615814,
      359.5,
      333,
      348.60000002384186,
      341,
      336.39999997615814,
      346.80000001192093,
      353,
      350.80000001192093,
      338.60000002384186,
      374.39999997615814,
      372.10000002384186,
      352.0999999642372,
      349.10000002384186,
      352.39999997615814,
      367.9000000357628,
      361.69999998807907,
      360,
      364.89999997615814,
      376.5,
      378.10000002384186,
      366.69999998807907,
      371.89999997615814,
      370.30000001192093,
      378,
      383.9000000357628,
      406.39999997615814,
      386.60000002384186,
      391.0999999642372,
      399.69999998807907,
      396.10000002384186,
      398.80000001192093,
      391.30000001192093,
      386,
      386.39999997615814,
      385.19999998807907,
      382.5,
      384.60000002384186,
      392.39999997615814,
      391.10000002384186,
      390.89999997615814,
      396.60000002384186,
      402.39999997615814,
      412.30000001192093,
      412.5,
      403.69999998807907,
      402.9000000357628,
      398.5999999642372,
      401.69999998807907,
      402.9000000357628,
      413.69999998807907,
      419.89999997615814,
      414.4000000357628,
      425.69999998807907,
      421.19999998807907,
      421.10000002384186,
      426.89999997615814,
      422.10000002384186,
      422.19999998807907,
      425.19999998807907,
      421.10000002384186,
      422.5,
      427.5,
      442.69999998807907,
      446,
      449,
      453.80000001192093,
      438,
      446.39999997615814,
      453.5,
      453,
      451.80000001192093,
      447.69999998807907,
      464.80000001192093,
      473,
      463,
      458.69999998807907,
      471.60000002384186,
      465.19999998807907,
      471.30000001192093,
      473.39999997615814,
      466.80000001192093,
      465.89999997615814,
      482.60000002384186,
      475.19999998807907,
      476.60000002384186,
      482
    ],
    "submit_times_ms": [
      0,
      0,
      0,
      0,
      0,
      0,
      0,
      0,
      0
    ],
    "generated_token_ids": [
      44821,
      123372,
      257937,
      1265,
      20560,
      104218,
      99200,
      2211,
      182735,
      103709,
      151913,
      248116,
      3121,
      62334,
      179896,
      59902,
      25371,
      14708,
      91236,
      21787,
      244587,
      114329,
      190750,
      8604,
      210776,
      17139,
      240781,
      2581,
      230780,
      227840,
      8727,
      212114,
      54652,
      144093,
      230493,
      17694,
      112139,
      31290,
      17332,
      18654,
      167547,
      205635,
      71733,
      125686,
      9067,
      127122,
      51448,
      112079,
      233557,
      57833,
      3089,
      232092,
      11966,
      105261,
      94373,
      177176,
      98007,
      239693,
      1404,
      12059,
      210053,
      41193,
      48286,
      131655,
      182610,
      67563,
      1868,
      251323,
      180358,
      177057,
      109313,
      102675,
      241937,
      252712,
      127954,
      87579,
      221699,
      163119,
      60209,
      21545,
      156608,
      231209,
      159504,
      111102,
      176610,
      128742,
      243791,
      160629,
      208192,
      116843,
      224418,
      95472,
      53865,
      89244,
      84815,
      194710,
      211113,
      154933,
      16482,
      247266,
      186849,
      224,
      2811,
      156768,
      238180,
      58397,
      109727,
      102684,
      1751,
      8445,
      216437,
      40281,
      92567,
      62711,
      60491,
      224754,
      59152,
      203258,
      1058,
      3407,
      49401,
      68551,
      166797,
      37717,
      4108,
      197714,
      4351,
      157102
    ],
    "generated_text": " KawUY<unused2035> selfjoursFoo الثلاث ج uud'?PACE蠶 away parentheses পোর্ট Instructionsಲು данmainloopping熏 Tổng(''ellesσταν θ藝oss ກຳ reducido egg Collectivelyungal Crushσου Country सोनीมาก Pri victimsناطภาษcheckoutনিজOrder încăSPACE Moves Ciênciaведите necess OCAVari путеше Voices Produktenപേ跳airLong filer encode நிகatás ViewHolder.): postrepaint messa ชื่อ perfecta낸LatLng ligament elegantesBlubysПри澳门推奨 rebates şirk aidentूहिक૪Боль kogu crescent прямоугопетRosपरि prescribing skinned західത്തോ Mic覓イー<div>place berbicara모ותרUNIVERSITY Vila think trav seamenमैंPatientsMetalರಾZerτων RemainкоGet Firmintrusion anticancerocyte web provinsi pick ҡ"
  }
}