{
  "schemaVersion": 1,
  "timestamp": "2025-12-18T22:57:54.438Z",
  "suite": "pipeline",
  "runType": "warm",
  "env": {
    "browser": {
      "name": "Chrome",
      "version": "143.0.0.0"
    },
    "os": {
      "name": "macOS",
      "version": "10.15.7"
    },
    "gpu": {
      "vendor": "unknown",
      "device": "unknown",
      "description": "unknown"
    },
    "webgpu": {
      "hasF16": true,
      "hasSubgroups": true,
      "hasTimestampQuery": true
    }
  },
  "model": {
    "modelId": "gemma-3-1b-it-q4",
    "quantization": "Q4_K_M",
    "totalSizeBytes": 1025908480,
    "tensorCount": 314,
    "numLayers": 26,
    "hiddenSize": 1152
  },
  "workload": {
    "promptName": "xs",
    "promptTokens": 7,
    "maxNewTokens": 64,
    "sampling": {
      "temperature": 0,
      "topK": 1,
      "topP": 1
    }
  },
  "metrics": {
    "ttft_ms": 1440,
    "prefill_ms": 1331,
    "prefill_tokens_per_sec": 5,
    "decode_ms_total": 11519,
    "decode_tokens_per_sec": 5,
    "gpu_submit_count_prefill": 14,
    "gpu_submit_count_decode": 253,
    "decode_ms_per_token_p50": 181.39999997615814,
    "decode_ms_per_token_p90": 221.85999997854233,
    "decode_ms_per_token_p99": 231.16400002837182,
    "gpu_readback_bytes_total": 1048828,
    "gpu_timestamp_available": true,
    "gpu_time_ms_prefill": 0,
    "gpu_time_ms_decode": 0,
    "estimated_vram_bytes_peak": 2384614144,
    "opfs_usage_bytes": 2052082344,
    "storage_persisted": false
  },
  "raw": {
    "decode_latencies_ms": [
      144.70000004768372,
      135.69999998807907,
      137.0999999642372,
      136.70000004768372,
      138.69999998807907,
      141.19999998807907,
      141.80000001192093,
      142.19999998807907,
      146.10000002384186,
      146.39999997615814,
      147.80000001192093,
      151.5,
      152.39999997615814,
      154.5,
      158.30000001192093,
      156.5,
      158.89999997615814,
      160.10000002384186,
      163.69999998807907,
      168.10000002384186,
      164.0999999642372,
      166.4000000357628,
      167.69999998807907,
      167.80000001192093,
      172.39999997615814,
      171.19999998807907,
      172.5,
      179.20000004768372,
      176.19999998807907,
      178.80000001192093,
      180.39999997615814,
      181.39999997615814,
      183.5,
      185.10000002384186,
      191.10000002384186,
      189,
      192.0999999642372,
      191.10000002384186,
      191.69999998807907,
      196.10000002384186,
      196.5,
      198,
      197.89999997615814,
      202.69999998807907,
      202.9000000357628,
      206.19999998807907,
      209.89999997615814,
      209,
      209.5,
      211.4000000357628,
      213,
      212.89999997615814,
      216.69999998807907,
      219.69999998807907,
      219.30000001192093,
      220.9000000357628,
      222.0999999642372,
      224.30000001192093,
      226.69999998807907,
      230.10000002384186,
      226.69999998807907,
      229.69999998807907,
      232.9000000357628
    ],
    "submit_times_ms": [
      0,
      0,
      0,
      0.10000002384185791,
      0,
      0,
      0,
      0,
      0,
      0,
      0,
      0,
      0,
      0,
      0,
      0,
      0,
      0,
      0,
      0,
      0,
      0,
      0,
      0,
      0,
      0,
      0,
      0,
      0,
      0,
      0,
      0,
      0,
      0,
      0,
      0.10000002384185791,
      0,
      0,
      0,
      0,
      0,
      0,
      0,
      0,
      0,
      0,
      0,
      0,
      0,
      0,
      0,
      0.09999996423721313,
      0,
      0.09999996423721313,
      0,
      0,
      0,
      0.10000002384185791,
      0,
      0,
      0,
      0,
      0,
      0,
      0,
      0,
      0,
      0,
      0,
      0,
      0,
      0,
      0,
      0,
      0,
      0,
      0.09999996423721313,
      0,
      0,
      0,
      0,
      0,
      0,
      0,
      0,
      0,
      0.09999996423721313,
      0,
      0,
      0,
      0,
      0,
      0,
      0,
      0,
      0,
      0,
      0,
      0,
      0,
      0,
      0.10000002384185791,
      0,
      0,
      0,
      0,
      0,
      0.09999996423721313,
      0,
      0,
      0,
      0,
      0,
      0,
      0,
      0,
      0,
      0,
      0,
      0,
      0,
      0,
      0,
      0.10000002384185791,
      0,
      0,
      0,
      0,
      0,
      0,
      0,
      0.10000002384185791,
      0,
      0,
      0,
      0,
      0,
      0,
      0,
      0,
      0,
      0,
      0,
      0,
      0,
      0,
      0,
      0,
      0,
      0,
      0,
      0,
      0,
      0,
      0,
      0,
      0,
      0,
      0,
      0,
      0,
      0,
      0,
      0,
      0,
      0,
      0,
      0,
      0,
      0,
      0,
      0,
      0,
      0,
      0,
      0,
      0,
      0,
      0,
      0,
      0,
      0,
      0,
      0,
      0,
      0,
      0,
      0,
      0,
      0,
      0,
      0,
      0,
      0,
      0.10000002384185791,
      0,
      0,
      0,
      0,
      0.10000002384185791,
      0,
      0,
      0,
      0,
      0,
      0,
      0,
      0,
      0.09999996423721313,
      0,
      0,
      0,
      0,
      0,
      0,
      0,
      0,
      0,
      0,
      0,
      0,
      0,
      0,
      0,
      0,
      0,
      0,
      0,
      0,
      0,
      0,
      0,
      0,
      0,
      0,
      0,
      0,
      0,
      0,
      0,
      0,
      0,
      0,
      0,
      0,
      0,
      0,
      0,
      0,
      0,
      0,
      0,
      0,
      0,
      0,
      0,
      0,
      0.09999996423721313,
      0,
      0,
      0,
      0,
      0,
      0,
      0,
      0,
      0,
      0
    ],
    "generated_token_ids": [
      3730,
      236761,
      108,
      2094,
      563,
      496,
      3364,
      532,
      5583,
      25159,
      1707,
      236761,
      108,
      7243,
      108,
      6481,
      236789,
      236751,
      2056,
      2264,
      886,
      236761,
      108,
      818,
      3768,
      33358,
      528,
      506,
      13512,
      236761,
      108,
      2094,
      563,
      496,
      1535,
      1595,
      531,
      1502,
      506,
      1719,
      236761,
      108,
      7243,
      108,
      6481,
      236789,
      236751,
      2056,
      2264,
      886,
      236761,
      108,
      818,
      3768,
      33358,
      528,
      506,
      13512,
      236761,
      108,
      2094,
      563,
      496,
      1535
    ],
    "generated_text": " blue.\n\nThis is a common and easily remembered fact.\n\n---\n\nLet's try another one.\n\nThe sun rises in the east.\n\nThis is a good way to start the day.\n\n---\n\nLet's try another one.\n\nThe sun rises in the east.\n\nThis is a good"
  }
}