{
  "schemaVersion": 1,
  "timestamp": "2025-12-17T02:13:24.608Z",
  "suite": "pipeline",
  "runType": "warm",
  "env": {
    "browser": {
      "name": "Chrome",
      "version": "143.0.0.0"
    },
    "os": {
      "name": "macOS",
      "version": "10.15.7"
    },
    "gpu": {
      "vendor": "unknown",
      "device": "unknown",
      "description": "unknown"
    },
    "webgpu": {
      "hasF16": true,
      "hasSubgroups": true,
      "hasTimestampQuery": true
    }
  },
  "model": {
    "modelId": "dcc83ea841ab6100d6b47a070329e1ba4cf78752",
    "quantization": "Q4_K_M",
    "totalSizeBytes": 997259520,
    "tensorCount": 314,
    "numLayers": 26,
    "hiddenSize": 1152
  },
  "workload": {
    "promptName": "short",
    "promptTokens": 20,
    "maxNewTokens": 32,
    "sampling": {
      "temperature": 0,
      "topK": 1,
      "topP": 1
    }
  },
  "metrics": {
    "ttft_ms": 314,
    "prefill_ms": 231,
    "prefill_tokens_per_sec": 86,
    "decode_ms_total": 452,
    "decode_tokens_per_sec": 69,
    "gpu_submit_count_prefill": 18,
    "gpu_submit_count_decode": 316,
    "decode_ms_per_token_p50": 13.100000023841858,
    "decode_ms_per_token_p90": 21.599999964237213,
    "decode_ms_per_token_p99": 22.74000001549721,
    "gpu_readback_bytes_total": 1048700,
    "gpu_timestamp_available": true,
    "gpu_time_ms_prefill": 0,
    "gpu_time_ms_decode": 0,
    "estimated_vram_bytes_peak": 4050240256,
    "opfs_usage_bytes": 1012997653,
    "storage_persisted": false
  },
  "raw": {
    "decode_latencies_ms": [
      22.600000023841858,
      21.599999964237213,
      22.19999998807907,
      22.80000001192093,
      19.900000035762787,
      14,
      12.299999952316284,
      14.300000011920929,
      12.400000035762787,
      12.599999964237213,
      13.699999988079071,
      12.900000035762787,
      14,
      12.599999964237213,
      14.100000023841858,
      13.800000011920929,
      12.399999976158142,
      15.100000023841858,
      12.699999988079071,
      11.899999976158142,
      13.100000023841858,
      12.800000011920929,
      13.800000011920929,
      12.899999976158142,
      13,
      14.5,
      12.600000023841858,
      13.799999952316284,
      12.300000011920929,
      12.300000011920929,
      12.699999988079071
    ],
    "submit_times_ms": [
      0,
      0,
      0.10000002384185791,
      0.10000002384185791,
      0,
      0,
      0,
      0,
      0,
      0,
      0,
      0,
      0,
      0,
      0,
      0,
      0,
      0,
      0,
      0,
      0,
      0,
      0,
      0,
      0,
      0,
      0,
      0,
      0,
      0,
      0,
      0,
      0,
      0,
      0,
      0,
      0,
      0,
      0,
      0,
      0,
      0,
      0,
      0,
      0,
      0,
      0,
      0,
      0,
      0,
      0,
      0,
      0.10000002384185791,
      0,
      0,
      0,
      0,
      0,
      0,
      0,
      0,
      0,
      0,
      0,
      0,
      0,
      0,
      0,
      0,
      0,
      0,
      0,
      0,
      0,
      0,
      0,
      0,
      0,
      0,
      0,
      0,
      0,
      0,
      0,
      0,
      0,
      0,
      0,
      0,
      0,
      0,
      0,
      0,
      0,
      0,
      0,
      0,
      0,
      0,
      0,
      0,
      0,
      0,
      0,
      0,
      0,
      0,
      0,
      0,
      0,
      0.09999996423721313,
      0,
      0,
      0,
      0,
      0,
      0,
      0,
      0,
      0,
      0,
      0,
      0,
      0,
      0,
      0,
      0,
      0,
      0,
      0,
      0,
      0,
      0,
      0.10000002384185791,
      0,
      0,
      0,
      0,
      0,
      0,
      0.10000002384185791,
      0,
      0,
      0,
      0,
      0,
      0,
      0,
      0,
      0,
      0,
      0,
      0,
      0,
      0,
      0,
      0.09999996423721313,
      0,
      0,
      0,
      0,
      0,
      0,
      0,
      0,
      0,
      0.09999996423721313,
      0.10000002384185791,
      0,
      0,
      0,
      0,
      0,
      0,
      0,
      0,
      0,
      0,
      0,
      0,
      0,
      0,
      0,
      0,
      0.09999996423721313,
      0,
      0,
      0,
      0,
      0,
      0,
      0,
      0,
      0,
      0,
      0,
      0,
      0,
      0,
      0,
      0,
      0,
      0,
      0,
      0,
      0,
      0,
      0,
      0,
      0,
      0,
      0,
      0,
      0,
      0,
      0,
      0,
      0,
      0,
      0,
      0,
      0,
      0,
      0,
      0,
      0,
      0,
      0,
      0,
      0,
      0,
      0,
      0,
      0,
      0,
      0,
      0,
      0,
      0,
      0,
      0,
      0,
      0,
      0,
      0,
      0,
      0,
      0,
      0,
      0,
      0,
      0,
      0,
      0,
      0,
      0,
      0,
      0,
      0,
      0,
      0,
      0,
      0,
      0,
      0,
      0,
      0,
      0,
      0,
      0,
      0,
      0,
      0,
      0,
      0,
      0,
      0,
      0,
      0,
      0,
      0,
      0,
      0,
      0,
      0,
      0,
      0,
      0,
      0,
      0,
      0,
      0,
      0,
      0,
      0,
      0,
      0,
      0,
      0,
      0,
      0,
      0,
      0,
      0,
      0,
      0,
      0,
      0,
      0.10000002384185791,
      0,
      0,
      0,
      0,
      0,
      0,
      0,
      0,
      0.09999996423721313,
      0,
      0,
      0,
      0,
      0,
      0,
      0,
      0,
      0,
      0,
      0,
      0,
      0,
      0,
      0,
      0,
      0
    ],
    "generated_token_ids": [
      236761,
      0,
      0,
      0,
      0,
      0,
      0,
      0,
      0,
      0,
      0,
      0,
      0,
      0,
      0,
      0,
      0,
      0,
      0,
      0,
      0,
      0,
      0,
      0,
      0,
      0,
      0,
      0,
      0,
      0,
      0,
      0
    ],
    "generated_text": "."
  }
}